{
  "$schema": "https://mekong-hcm.local/contracts/programming/artifact_build_manifest_v1.schema.json",
  "artifact": {
    "bytes": 672,
    "fileSha256": "289be809a89a16ad4b25e7af8645e6af07bb1b20832550df0952c7dadafdeb13",
    "integrityMode": "HASH_ONLY",
    "integritySha256": "a78dc21d0979f1b36bd3f4cf561576b379cba194716b35a3480d6e35266e5f61",
    "magic": "MKDDCIR1",
    "schemaVersion": 1,
    "signaturePresent": false
  },
  "buildKeySha256": "d334faacdac73d6d62c3499e426397f4396d9180017799d287beda1c3d8941cb",
  "compiler": {
    "id": "mkddc-programming-compiler",
    "lowererVersion": "fwsom-fbd-1.0.0",
    "version": "fwsom-st-1.2.0"
  },
  "manifestVersion": 1,
  "profile": {
    "code": 1,
    "id": "revA-1t-1-5-30",
    "libraryVersion": "rev-a.1",
    "sha256": "d2866c41065e2a51fba88460068df453d63b6e95b30879eba292f4b667b49ede"
  },
  "source": {
    "canonicalBytes": 2302,
    "canonicalSha256": "8e77c74e803ade2afee2781ee17a7fc51abfa2d5eb8aa8cd1a1e527b15f29409",
    "language": "FBD",
    "sourceId": "golden-fbd"
  },
  "sourceMap": {
    "entries": [
      {
        "encodedColumn": 5,
        "encodedLine": 1,
        "fbdLocation": {
          "networkId": "20000000-0000-4000-8000-000000000001",
          "nodeId": "30000000-0000-4000-8000-000000000003",
          "portId": "40000000-0000-4000-8000-000000000005"
        },
        "pc": 0,
        "sourceId": "golden-fbd",
        "textLocation": null,
        "unit": null
      },
      {
        "encodedColumn": 6,
        "encodedLine": 1,
        "fbdLocation": {
          "networkId": "20000000-0000-4000-8000-000000000001",
          "nodeId": "30000000-0000-4000-8000-000000000004",
          "portId": "40000000-0000-4000-8000-000000000006"
        },
        "pc": 1,
        "sourceId": "golden-fbd",
        "textLocation": null,
        "unit": null
      }
    ],
    "version": 1
  },
  "target": {
    "abi": 3841
  }
}
